,date,text,sentiment,title,Ticker
565,"Fri, 30 Aug 2019 11:26:02 -0400","China will exempt Tesla Inc's  electric vehicles from its purchase tax, the Ministry of Industry and Information Technology (MIIT) said on its website on Friday.    China currently levies a 10% purchase tax on the sale of each vehicle.",Positive,China to exempt Tesla cars from purchase tax,TSLA
566,"Fri, 30 Aug 2019 10:54:36 -0400","A new Tesla model unveiling is around the corner, this time in the pickup category.",Positive,Your Digital Self: Tesla’s unveiling of a pickup truck is right around the corner,TSLA
567,"Fri, 30 Aug 2019 10:38:27 -0400",Tesla Inc. (NASDAQ: TSLA) has raised its vehicle prices in China ahead of new Chinese tariffs on imported U.S.,Neutral,Tesla Raises Prices In China Ahead Of Tariff Increase,TSLA
568,"Fri, 30 Aug 2019 09:34:50 -0400","Tesla stock jumped Friday as China’s automotive regulatory body said it will exempt Tesla vehicles from its purchase tax, which will help the electric car company avoid costs from tariffs
The post Tesla Stock Jumps As China Exempts Vehicles From Auto Tax appeared first on Investor's Business Daily.",Positive,Tesla Stock Jumps As China Exempts Vehicles From Auto Tax,TSLA
569,"Fri, 30 Aug 2019 09:10:27 -0400","Tesla had raised prices for some vehicles in China as the yuan trades at its weakest levels in more than a decade. The starting price for the Model X SUV is now 809,900 yuan ($114,186), versus 790,900 yuan previously, according to Tesla’s China website on Friday.",Neutral,"Tesla hikes prices for Model 3, other cars in China",TSLA
570,"Fri, 30 Aug 2019 08:21:43 -0400","China will exempt Tesla Inc's  electric vehicles (EV) from purchase tax, the Ministry of Industry and Information Technology (MIIT) said on its website.",Positive,China will exempt Tesla cars from purchase tax,TSLA
571,"Fri, 30 Aug 2019 07:49:38 -0400",CNBC's Melissa Lee reports on a jump in Tesla shares on news that the company will be exempt from a tax on Chinese auto purchases.,Positive,Tesla to be exempt from China auto purchase tax,TSLA
572,"Fri, 30 Aug 2019 07:46:29 -0400","Tesla Inc. shares TSLA, +2.84% rose 4.9% in premarket trade Friday, after a report that China will exempt 16 of the electric car maker's models from purchase tax.",Positive,Tesla shares soar 4.9% premarket on report China to exempt 16 models from purchase tax,TSLA
573,"Fri, 30 Aug 2019 07:30:00 -0400",China's automotive regulatory body declared on Friday that it will exempt Tesla electric vehicles from its purchase tax.,Positive,China will exempt multiple Tesla models from auto tariffs,TSLA
574,"Fri, 30 Aug 2019 07:19:52 -0400","China will exempt 16 Tesla Inc  electric vehicle (EV) models from purchase tax, the Ministry of Industry and Information Technology said in a statement on its website.",Positive,China will exempt 16 Tesla models from purchase tax,TSLA
575,"Fri, 30 Aug 2019 06:54:52 -0400","The ""Squawk Box"" crew talk about several of the morning's top stories.",Neutral,Executive Edge: Three stocks with China exposure,TSLA
576,"Fri, 30 Aug 2019 01:03:54 -0400","Tesla Inc  has always shown disdain for marketing, with CEO Elon Musk boasting his company does not advertise, instead using the money it would have spent to develop products.",Neutral,"With racing and music events, Tesla gets over marketing allergy in China",TSLA
577,"Fri, 30 Aug 2019 00:55:18 -0400",U.S. electric vehicle maker Tesla Inc  had raised prices for some vehicles in China as the yuan trades at its weakest levels in more than a decade.,Neutral,"Tesla hikes prices for Model 3, other cars in China amid weaker yuan",TSLA
578,"Thu, 29 Aug 2019 23:41:49 -0400","U.S. electric vehicles maker Tesla Inc  said on Friday it had raised prices for some vehicles in China, a decision that comes as the Chinese yuan trades at its weakest levels in more than 10 years.",Neutral,Tesla raises prices for some vehicles in China,TSLA
579,"Thu, 29 Aug 2019 12:30:34 -0400","Elon Musk's passion for his projects has inspired millions of followers. However, that same passion has led him to repeatedly make terrible decisions that have hurt TSLA stock.",Negative,Elon Musk’s Passion Puts Tesla Stock At Risk,TSLA
580,"Thu, 29 Aug 2019 11:43:38 -0400",Yahoo Finance's Dan Roberts reports on Tesla offering car insurance to Tesla owners with the hopes of saving them money.,Positive,Tesla offers car insurance to Tesla owners in California,TSLA
581,"Thu, 29 Aug 2019 11:10:12 -0400","""Steady demand"" for Tesla Inc.'s TSLA, +2.83% Model 3 in Europe is likely to help weakness in China, analysts at Wedbush said in a note Thursday.",Positive,Tesla's Model 3 enjoying 'steady demand' in Europe: analyst,TSLA
582,"Thu, 29 Aug 2019 09:25:24 -0400",Tesla Inc (NASDAQ: TSLA) shares ticked higher on Thursday after one analyst said international trade disputes doesn’t seem to be hurting Tesla’s Euopean business as much as feared.,Neutral,"Tesla Analyst: Europe Business Steady, 'Demand Challenges Remain'",TSLA
583,"Wed, 28 Aug 2019 20:33:00 -0400","Rates could be up to 20% to 30% lower than third-party insurers, the automaker says.",Neutral,Tesla Is Getting Into the Insurance Business,TSLA
584,"Wed, 28 Aug 2019 19:12:42 -0400","Tesla Inc said on Wednesday it was launching an insurance service designed to give drivers in California, its biggest market, lower rates because of safety features on its electric vehicles.",Positive,Tesla rolls out insurance in California,TSLA
585,"Wed, 28 Aug 2019 17:26:20 -0400","Cathie Wood, CEO of Ark Invest, explains what's in her portfolio on CNBC's ""Closing Bell.",Positive,Ark Invest's Cathie Wood breaks down her firm's picks,TSLA
586,"Wed, 28 Aug 2019 16:39:00 -0400","Tesla (NASDAQ:TSLA) has significantly scaled up its production over the last few years, driven by the Model 3. In this analysis, we take a closer look at Tesla’s total deliveries and compare them with other rivals in the luxury market.",Neutral,"How Tesla's Deliveries Compare With Luxury Rivals Audi, BMW, Mercedes",TSLA
587,"Wed, 28 Aug 2019 16:17:11 -0400",The automaker claims owners can get rates up to 30% lower than with traditional insurers.,Positive,"Tesla launches its own insurance in California, more states to come",TSLA
588,"Wed, 28 Aug 2019 16:12:44 -0400","Tesla said Wednesday it has launched an insurance product, promising owners of its electric vehicles to deliver rates 20% and even as high as 30% lower than other insurance providers. For now, the product known as Tesla Insurance, will only be available to owners in California.",Positive,Tesla promises up to 30% lower rates with new car insurance play,TSLA
589,"Wed, 28 Aug 2019 16:00:15 -0400","Joe Osha, senior energy technology analyst at JMP Securities, talks about why he has sees Tesla outperforming and what he thinks is next for the company under the leadership of Elon Musk with CNBC's ""Closing Bell"" team.",Neutral,Tesla needs Elon Musk as a thought leader: Energy technology analyst,TSLA
590,"Wed, 28 Aug 2019 15:56:24 -0400",One issue in calculating the cost over any automobile’s life is the car insurance rates.,Neutral,Tesla Gambles on Offering Discounted Car Insurance on its Vehicles,TSLA
591,"Wed, 28 Aug 2019 15:54:55 -0400",Tesla Inc (NASDAQ: TSLA) announced Wednesday it's launching an insurance division to offer Tesla owners cheaper coverage for their cars.,Positive,Tesla Rolls Out Car Insurance Unit For Drivers of Its Cars In California,TSLA
592,"Wed, 28 Aug 2019 15:53:22 -0400","Tesla Inc. TSLA, +0.71% late Wednesday launched Tesla Insurance, described as ""a competitively priced insurance designed to provide Tesla owners with up to 20% lower rates, and in some cases as much as 30%"" and initially limited to Tesla owners in California.",Positive,Tesla launches its car insurance in California,TSLA
593,"Wed, 28 Aug 2019 15:48:00 -0400",Tesla began selling Tesla Insurance for its cars in California on Wednesday.,Positive,Tesla starts selling its own car insurance in California,TSLA
594,"Wed, 28 Aug 2019 10:24:16 -0400","Bethany McLean, contributing editor for Vanity Fair, joins 'Squawk Box' to discuss her piece on Tesla CEO Elon Musk's bet on SolarCity.",Neutral,How Tesla's SolarCity factory in Buffalo is affecting the community,TSLA
595,"Wed, 28 Aug 2019 09:43:06 -0400","A partnership of TSLA and Volkswagen would be great for Tesla. If the deal goes through, investors should buy Tesla stock.",Positive,Buy Tesla Stock if TSLA Hooks Up With Volkswagen,TSLA
596,"Wed, 28 Aug 2019 00:49:00 -0400",Electric carmaker Tesla will reportedly increase prices in China this week in anticipation of rising tariffs — but one automobile expert says the higher costs will not likely last.,Neutral,"Tesla may be raising prices in China — but it won't be for long, analyst says",TSLA
597,"Tue, 27 Aug 2019 14:48:00 -0400","The first electric car came out in the 1800s, but quickly lost steam thanks to Henry Ford. It took another innovator to bring them back into the mainstream over 100 years later.",Neutral,How Elon Musk and Tesla Made Electric Cars Cool,TSLA
598,"Tue, 27 Aug 2019 12:43:06 -0400",Tesla stock faces renewed concerns regarding quality and management. The Musk Mojo looks to be running out.,Negative,Tesla Stock Faces More Bad News After Walmart Lawsuit,TSLA
599,"Tue, 27 Aug 2019 10:19:00 -0400","Tesla (TSLA) is in advanced talks with LG Chem to buy batteries for the electric vehicles manufactured at the Shanghai plant, according to reports.",Neutral,"Tesla (TSLA) to Hike Prices in China, In Talks With LG Chem",TSLA
600,"Tue, 27 Aug 2019 08:06:00 -0400",The point of no return on the transition to electric vehicles may be closer than you think.,Neutral,Are Electric Vehicles Near a Tipping Point?,TSLA
601,"Mon, 26 Aug 2019 10:55:00 -0400","The rising trade rift between the United States and China, resulting in tit-for-tat tariffs without any meaningful negotiations, is likely to have a negative impact on the auto industry.",Negative,Rising Trade Tiff Puts the Brakes on U.S. Auto Biggies' Ride,TSLA
602,"Mon, 26 Aug 2019 09:02:14 -0400","US electric vehicle maker Tesla will raise prices in China on Friday, earlier than planned, and is considering increasing prices again in December should Chinese tariffs on US-made cars take effect, people familiar with the matter said. The people declined to be identified as the plan has not been made public.",Negative,Tesla plans to raise prices in China amid trade war,TSLA
603,"Mon, 26 Aug 2019 08:35:00 -0400",Tesla plans to raise prices in China on Friday and could hike them again in December should Chinese tariffs on U.S.-made cars take effect.,Negative,Tesla to raise prices in China on August 30 as trade war escalates,TSLA
604,"Mon, 26 Aug 2019 07:48:47 -0400",CNBC's Phil LeBeau reports on how the auto industry are being hit by the trade war and what companies are doing to adjust to the challenges.,Negative,How automakers are handling trade war fallout,TSLA
605,"Mon, 26 Aug 2019 04:42:04 -0400","Tesla Inc  CEO Elon Musk and Alibaba Group Holding Ltd  chairman Jack Ma will speak at a conference on artificial intelligence (AI) to be held this week in Shanghai, an Alibaba spokeswoman said on Monday.",Neutral,"Tesla's Musk, Alibaba's Ma to talk at Shanghai tech event this week",TSLA
606,"Mon, 26 Aug 2019 03:37:29 -0400","U.S. electric vehicle maker Tesla Inc  will on Friday raise its prices in China, earlier than planned, and is considering increasing prices again in December should Chinese tariffs on U.S.-made cars take effect, two people familiar with the matter said.",Neutral,"Tesla to raise prices in China on August 30, may increase again in December: sources",TSLA
607,"Sun, 25 Aug 2019 11:35:00 -0400","Elon Musk's electric-car maker has big plans, but can it outperform?",Negative,Is Tesla a Buy?,TSLA
608,"Sun, 25 Aug 2019 10:38:08 -0400","Electric carmaker Tesla  is scouting out locations for a possible factory in the German state of North Rhine-Westphalia (NRW), Germany's most populous state, daily Rheinische Post reported on Sunday, citing people familiar with the matter.",Neutral,Tesla scouting sites for possible factory in Germany's NRW: Rheinische Post,TSLA
609,"Sun, 25 Aug 2019 09:04:00 -0400","Both are among the leaders in self-driving cars, but they are taking entirely different routes to their destinations.",Neutral,Better Robotaxi Stock: Alphabet or Tesla?,TSLA
610,"Sat, 24 Aug 2019 14:18:00 -0400",There are some fatal flaws in Tesla's latest moves in solar energy.,Negative,"Tesla's ""Relaunch"" of Solar Is Another Swing and Miss",TSLA
611,"Fri, 23 Aug 2019 21:51:37 -0400","A prominent hedge fund manager is calling on Tesla Chief Executive Elon Musk to resign following reports that the electric automaker’s solar panels have been catching fire. Greenlight Capital’s David Einhorn, a short-seller who has publicly sparred with Musk in the past, tweeted his comments Friday morning in the wake of Walmart suing Tesla, claiming.",Negative,Tesla short-seller David Einhorn calls on Elon Musk to resign,TSLA
612,"Fri, 23 Aug 2019 20:28:00 -0400","Tesla solar panels ignited at an Amazon warehouse in Redlands, California in June 2018, Bloomberg reports. The news comes days after Walmart sued Tesla for at least 7 fires allegedly caused by defects in the solar roofs on Walmart stores.",Negative,Tesla solar panels reportedly caught fire at an Amazon warehouse in 2018,TSLA
613,"Fri, 23 Aug 2019 18:05:26 -0400","Walmart and Tesla are working toward settling a recent lawsuit brought by the department store giant against the energy company for solar panels that Walmart said caused fires at seven different stores. On Tuesday, Walmart filed a Manhattan Supreme Court lawsuit to terminate a contract with Tesla for solar panels at 244 stores after the.",Negative,"Walmart, Tesla working to settle lawsuit after solar panel fires",TSLA
614,"Fri, 23 Aug 2019 17:35:18 -0400","Walmart came out swinging earlier this week in a lawsuit that accused Tesla of breach of contract and gross negligence over problems with rooftop solar panel systems installed at the retail giant’s stores. Now, just days later, the lawsuit has been placed on hold while the two companies try to reach an agreement that would […]",Neutral,Walmart and Tesla are going to try and work things out,TSLA
615,"Fri, 23 Aug 2019 16:25:09 -0400","David Einhorn (Trades, Portfolio) of Greenlight Capital, who is short Tesla Inc. (NASDAQ:TSLA), has been trading barbs with Elon Musk for the last several years.",Negative,David Einhorn: Elon Musk Should Step Down,TSLA
616,"Fri, 23 Aug 2019 12:13:00 -0400",Here's an in-depth look at the biggest companies that have significant exposure to the renewable energy sector.,Positive,The 10 Biggest Renewable Energy Stocks,TSLA
617,"Fri, 23 Aug 2019 12:03:00 -0400","The two American car companies are among the top exporters of U.S.-produced vehicles to China along with BMW and Daimler/Mercedes-Benz, according to industry data obtained by CNBC.",Negative,"Tesla, Ford have the most to lose among US carmakers on China's new round of tariffs",TSLA
618,"Fri, 23 Aug 2019 10:02:00 -0400","On Tuesday, Walmart filed suit against Tesla alleging its solar panels had caused fires in seven of its stores.",Negative,Tesla short David Einhorn says Elon Musk should resign over solar panel fires,TSLA
619,"Fri, 23 Aug 2019 09:31:31 -0400",Tesla (TSLA) reported earnings 30 days ago. What's next for the stock?,Negative,Tesla (TSLA) Down 2.9% Since Last Earnings Report: Can It Rebound?,TSLA
620,"Fri, 23 Aug 2019 09:24:59 -0400",Tesla stock is down 33% year-to-date but there is a way to trade it with 85% certainty. The buyout rumors are the reason this is possible.,Neutral,Trade the TSLA Stock Rumor With Confidence,TSLA
621,"Fri, 23 Aug 2019 05:02:41 -0400","U.S. electric vehicle maker Tesla Inc  is in advanced talks with South Korea's LG Chem Ltd  to source batteries for vehicles to be made in its Shanghai plant, a person familiar with the matter said.",Neutral,Tesla in advanced talks with LG Chem on battery supply in China: source,TSLA
622,"Fri, 23 Aug 2019 05:01:55 -0400","Never heard of the SHEconomy? It's time to learn up, and understand why these stocks will benefit from that demographic megatrend.",Positive,8 SHEconomy Stocks Morgan Stanley Says to Buy,TSLA
623,"Fri, 23 Aug 2019 02:13:01 -0400","Tesla Inc  has agreed to buy batteries from South Korea's LG Chem Ltd  for electric vehicles manufactured in China, Bloomberg reported on Friday citing people familiar with the matter.",Neutral,Tesla to buy batteries from South Korea's LG Chem: Bloomberg,TSLA
624,"Fri, 23 Aug 2019 00:08:30 -0400","Walmart Inc  and Tesla Inc  are looking to address all issues surrounding the solar installations at Walmart stores, the companies said late on Thursday, two days after the retailer sued the electric carmaker for ""widespread negligence"" that led to repeated fires at the installations.",Negative,"Walmart, Tesla look to address issues surrounding solar systems",TSLA
625,"Thu, 22 Aug 2019 18:23:00 -0400",It seems like every few months Tesla (TSLA) is in the news for a scandal or some production issue. TSLA has also been a hot stock for young investors and people searching for massive growth potential from a firm in game-changing industry.,Negative,What's Next for Tesla Stock After Walmart Sues Over Solar Panel Fires?,TSLA
626,"Thu, 22 Aug 2019 16:14:02 -0400","Colin Rusch from Oppenheimer and Mark Lehmann from JMP Securities join CNBC's ""Closing Bell"" to discuss James Anderson, a partner at Tesla's second-largest shareholder, and his criticism of the company under Elon Musk's leadership.",Neutral,Could Tesla survive without Elon Musk at the helm? Experts discuss,TSLA
627,"Thu, 22 Aug 2019 15:58:26 -0400","When Fed heads talk on top of geopolitics and yield curves headlines, markets sweat. SPLK, F, ULTA, DKS and TSLA are top stock trades.",Positive,"5 Top Stock Trades for Friday: SPLK, F, ULTA, TSLA, DKS",TSLA
628,"Thu, 22 Aug 2019 15:27:39 -0400",CNBC's Phil LeBeau talks about Volkswagen's denial of reports that the automaker is interested in Tesla stake.,Positive,Here's why an automaker may want to partner with Tesla,TSLA
629,"Thu, 22 Aug 2019 15:10:00 -0400","Tesla (NASDAQ: TSLA) and Biogen (NASDAQ: BIIB) have similar market caps of roughly $40 billion and both companies have seen their stocks fall by roughly 25% this year. While Biogen stock has declined after it ended phase-3 trials of its Alzheimer’s drug Aducanumab in March, Tesla’s stock has been.",Neutral,Which Stock: Tesla or Biogen? 2 Worlds. Same Price,TSLA
630,"Thu, 22 Aug 2019 13:23:37 -0400",Yahoo Finance's Pras Subramanian discusses why  Volkswagen and Tesla electric battery technology with  HyperChange CEO Galileo Russell.,Neutral,Why Elon Musk should sell Tesla to Volkswagen,TSLA
631,"Thu, 22 Aug 2019 12:35:45 -0400",Tesla Inc. (NASDAQ: TSLA) shares made a handy gain early on Thursday after mixed reports surfaced as to whether German auto manufacturer Volkswagen would be looking to take a stake in Elon Musk’s brainchild.,Neutral,Tesla’s Move Into Europe May Not Be Through Volkswagen,TSLA
632,"Thu, 22 Aug 2019 12:07:59 -0400","Henry Blodget of Business Insider joins ""Squawk Alley"" to discuss Tesla's stock, and calls from the company's top shareholder for Elon Musk to step down as CEO.",Negative,"Tesla needs to focus on being profitable, says Business Insider's Henry Blodget",TSLA
633,"Thu, 22 Aug 2019 09:36:00 -0400",Volkswagen denied a report Thursday that it has any interest in taking a stake in U.S. electric car maker Tesla.,Neutral,Volkswagen says report of interest in investing in Tesla is 'completely unfounded',TSLA
634,"Thu, 22 Aug 2019 09:26:44 -0400",Volkswagen  on Thursday denied a media report which suggested that the German carmaker was interested in buying a stake in United States electric car manufacturer Tesla.,Neutral,Volkswagen says it is not interested in buying a Tesla stake,TSLA
635,"Thu, 22 Aug 2019 09:23:00 -0400",A Volkswagen spokesperson called the report that CEO Herbert Diess is interested in buying a stake in Tesla “completely unfounded.”,Positive,Tesla shares give up gains after Volkswagen denies report it's interested in stake,TSLA
636,"Thu, 22 Aug 2019 09:15:03 -0400",Shares of Tesla rose on Thursday after a report out of Germany that Volkswagen CEO is interested in a stake of the company.,Positive,Tesla shares rise on report Volkswagen CEO is interested in stake,TSLA
637,"Thu, 22 Aug 2019 09:13:01 -0400",Tesla Inc (NASDAQ: TSLA) shares traded higher by 2.8% on Thursday morning after a German magazine suggested VOLKSWAGEN AG/ADR (OTC: VWAPY) may be interested in a buyout of Tesla.,Positive,Tesla Ticks Higher On Rumor Of Volkswagen Interest,TSLA
638,"Thu, 22 Aug 2019 09:10:42 -0400","Volkswagen  CEO Herbert Diess wants to take a stake in Tesla  to access the U.S. company's software and batteries technology, German business publication Manager Magazin reported on Thursday.",Positive,Volkswagen CEO wants a stake in Tesla: Manager Magazin,TSLA
639,"Thu, 22 Aug 2019 09:08:03 -0400","Shares of Tesla Inc. TSLA, -2.23% rallied 2.5% in premarket trading, after a report that some German automakers have interest in buying a stake in the electric car maker.",Positive,Tesla's stock jumps after report of investment interest by German automakers,TSLA
640,"Thu, 22 Aug 2019 08:34:00 -0400","CEO Herbert Diess is interested in acquiring a stake in Tesla, German business publication Manager Magazin reported on Thursday, citing company sources.",Positive,"Volkswagen CEO interested in Tesla stake, Manager Magazin reports",TSLA
641,"Thu, 22 Aug 2019 08:32:15 -0400","Walmart Inc  has sued Tesla Inc , accusing it of ""years of gross negligence and failure to live up to industry standards"" that led to several fires at its stores with Tesla solar systems.",Negative,Factbox: Walmart and Tesla fought in private long before solar lawsuit,TSLA
642,"Thu, 22 Aug 2019 07:59:48 -0400","Volkswagen  CEO Herbert Diess is interested in acquiring a stake in Tesla , German business publication Manager Magazin reported on Thursday, citing company sources.",Neutral,Volkswagen CEO interested in Tesla stake: Manager Magazin,TSLA
643,"Wed, 21 Aug 2019 17:46:00 -0400",Walmart just sued Tesla over SolarCity manufactured and installed panels that resulted in rooftop fires at seven of its stores.,Negative,Tesla Feels the Heat as Walmart Sues,TSLA
644,"Wed, 21 Aug 2019 16:59:10 -0400",Walmart is suing Tesla over their solar panel fires at seven of its stores.,Negative,Tesla shares singed after Walmart sues over solar panel fires,TSLA
645,"Wed, 21 Aug 2019 15:24:23 -0400","Tesla Inc. (NASDAQ:TSLA) is no stranger to lawsuits. Hundreds of disgruntled customers have filed individual and class-action suits alleging faults in its electric vehicles, as well as in its solar panels.",Negative,Walmart Takes Tesla to Court Over Faulty Solar Panels,TSLA
646,"Wed, 21 Aug 2019 14:16:37 -0400",Walmart is suing Tesla after some of Tesla's solar panels caught fire at seven Walmart stores.,Negative,"Walmart is suing Tesla over a solar panel fire, here's what you need to know",TSLA
647,"Wed, 21 Aug 2019 14:04:11 -0400","Fox Business Briefs: Walmart is suing Elon Musk's company for gross negligence, breach of contract and failure to meet industry standards.",Negative,Walmart suing Tesla over faulty solar panels,TSLA
648,"Wed, 21 Aug 2019 12:32:00 -0400",Shares of Tesla slid Wednesday on news of Walmart's lawsuit.,Negative,Tesla slides on news of Walmart suing over solar panel fires,TSLA
649,"Wed, 21 Aug 2019 12:11:12 -0400","Walmart (WMT) is suing Tesla (TSLA) over trouble it has with the company's solar panels catching fire and causing damage.
The post Walmart Sues Tesla Over Solar Panel Fires appeared first on InvestorPlace.",Negative,Walmart Sues Tesla Over Solar Panel Fires,TSLA
650,"Wed, 21 Aug 2019 11:47:43 -0400",Yahoo Finance's Alexis Keenan reports on the Walmart lawsuit alleging problems with solar panels that were installed and maintained  by Tesla's solar division.,Negative,Walmart sues Tesla over solar panel rooftop fires,TSLA
651,"Wed, 21 Aug 2019 11:18:13 -0400",Tesla still needs to prove it can make big money on electric cars. Until it does Tesla stock is massively over valued.,Neutral,Tesla Stock Needs to Start Trading Like a Car Stock,TSLA
652,"Wed, 21 Aug 2019 10:38:44 -0400","Musk’s greatest skill is in raising capital, but in the past five years that new capital—in excess of $20 billion—has led to greater losses and a much, much more levered balance sheet for Tesla.",Negative,Tesla Has Failed Massively As A Public Company,TSLA
653,"Wed, 21 Aug 2019 09:18:48 -0400",Walmart Inc (NYSE: WMT) is demanding Tesla Inc (NASDAQ: TSLA) pay for damages caused at seven stores and remove solar panels from hundreds of other retail locations.,Negative,Walmart Sues Tesla: Pay Us For Solar Panel Damages You Caused,TSLA
654,"Wed, 21 Aug 2019 07:55:00 -0400",Toni Sacconaghi said increased competition abroad is responsible for the weakness in Tesla's sales volume.,Negative,Top tech analyst says electric vehicles from Jaguar and Audi are stealing market share from Tesla,TSLA
655,"Wed, 21 Aug 2019 07:01:49 -0400",Tesla's struggling solar panel business was just dealt a reputational blow.,Negative,Walmart Suing Tesla for Years of Gross Negligence,TSLA
656,"Tue, 20 Aug 2019 20:35:17 -0400","Three fires broke out in the Spring of 2018. The first at a Beavercreek, Ohio location on March 7 that year cost the store $784,293 in repairs, lost merchandise and lawyers and consultant fees, the suit says.",Negative,Walmart claims roof fires caused by faulty Tesla solar panels,TSLA
