,date,text,sentiment,title,Ticker
1518,"Thu, 25 Apr 2019 17:10:01 -0400","Tesla is poised to open up orders for the Model 3 in several right-hand drive markets, starting with the UK by early May, according to a tweet from CEO Elon Musk.",Positive,"Tesla to open up Model 3 orders in UK, other right-hand drive markets",TSLA
1519,"Thu, 25 Apr 2019 15:50:00 -0400","Managing Director of Equity Research at Wedbush Securities, Dan Ives discusses why he has concerns about recommending Tesla to investors.",Negative,"Analyst on Tesla,' There's no pilot on the plane'",TSLA
1520,"Thu, 25 Apr 2019 15:30:01 -0400","Arndt Ellinghorst, head of global automotive research at Evercore ISI Group, discusses Tesla's first-quarter earnings report.",Positive,Elon Musk is part of the reason people love Tesla: Autos expert,TSLA
1521,"Thu, 25 Apr 2019 15:27:25 -0400","Tesla stock fell to a 52-week low Thursday, following its first-quarter earnings report that missed Wall Street estimates by a wide margin. Its Relative Strength line fell to a two-year low.",Negative,Tesla Stock Hits One-Year Low As Earnings Report Sinks In,TSLA
1522,"Thu, 25 Apr 2019 15:04:36 -0400","CNBC's ""Power Lunch"" hosts the 2019 Stock Draft. Celebrity chef Bobby Flay, professional poker player Maria Ho and New York Mets pitcher Noah Syndergaard make their first round picks.",Positive,"Bobby Flay, Maria Ho and Noah Syndergaard make their first round stock picks",TSLA
1523,"Thu, 25 Apr 2019 14:46:45 -0400","If the technology can be made to work, the robotaxi opportunity for Tesla far exceeds its current market cap.",Positive,Tesla's Data Advantage,TSLA
1524,"Thu, 25 Apr 2019 13:27:51 -0400","The ""Halftime Report"" traders debate Wedbush's call to downgrade Tesla to neutral",Negative,Longtime Tesla bull downgrades the stock to neutral,TSLA
1525,"Thu, 25 Apr 2019 11:40:55 -0400","Scott Gamm, Ikiko Fujita, Dan Roberts and Sibille Marcellus of Yahoo Finance discuss Tesla.",Negative,Tesla under pressure,TSLA
1526,"Thu, 25 Apr 2019 11:37:34 -0400",The earnings storm continues. Jim Cramer dives in on TSLA,Negative,Cramer Recap: Tesla,TSLA
1527,"Thu, 25 Apr 2019 10:42:35 -0400","The company reported an adjusted loss per share of $2.90, much worse than analysts' estimated loss per share of $0.69.",Negative,"Tesla Misses Analysts' Forecasts, Loses $2.90 Per Share In First Quarter",TSLA
1528,"Thu, 25 Apr 2019 10:38:22 -0400","Tesla Inc (NASDAQ: TSLA) shares were surprisingly resilient Thursday morning after the company reported first-quarter earnings that disappointed Wall Street analysts across the board.



  Latest Ratings for TSLA
     Date Firm Action From To     Apr 2019   Maintains Buy Buy   Apr 2019   Downgrades Outperform Neutral   Apr 2019   Downgrades In-Line Underperform    
    View More Analyst Ratings for TSLA
     View the Latest Analyst Ratings
  

 read more",Neutral,What To Make Of Tesla's Brutal Quarter,TSLA
1529,"Thu, 25 Apr 2019 09:57:48 -0400","Craig Irwin, senior research analyst at Roth Capital, and Tim Higgins, an auto reporter for the Wall Street Journal, join ""Squawk Box"" to discuss Tesla's earnings as well as CEO Elon Musk's ongoing court dispute with the U.S. Securities and Exchange Commission.",Neutral,Why this research analyst rates Tesla as a hold,TSLA
1530,"Thu, 25 Apr 2019 09:01:10 -0400","The deadline for Tesla's Elon Musk's contempt of court dispute to be resolved is today, but there's a chance it could be extended yet again. Jeff Sonnenfeld from the Yale School of Management, joins ""Squawk Box"" to discuss the battle.",Negative,"Tesla CEO Elon Musk should not make wild forecasts, says Yale's Jeff Sonnenfeld",TSLA
1531,"Thu, 25 Apr 2019 08:52:00 -0400","In first-quarter 2019, Tesla's (TSLA) vehicle production and delivery numbers register sequential declines of 10.9% and 31%, respectively.",Negative,Tesla (TSLA) Earnings and Revenues Miss Estimates in Q1,TSLA
1532,"Thu, 25 Apr 2019 08:47:04 -0400",Tesla Inc (NASDAQ: TSLA)’s dismal first-quarter earnings lost the stock one of its most loyal bulls.,Negative,Wedbush Calls Tesla's Q1 One Of The 'Top Debacles' In 20 Years Of Covering Tech,TSLA
1533,"Thu, 25 Apr 2019 07:51:00 -0400",Wedbush lowered its rating of Tesla shares to neutral from outperform on Thursday after the company reported a first-quarter loss that was far worse than Wall Street expected.,Negative,"Profitability will not 'magically return to the Tesla story,' analyst says in downgrade",TSLA
1534,"Thu, 25 Apr 2019 07:40:59 -0400",Tesla reported fourth-quarter and fiscal-year 2018 earnings after markets closed on Wednesday.,Neutral,Why Tesla’s Big Q1 Loss Doesn’t Matter,TSLA
1535,"Thu, 25 Apr 2019 07:18:42 -0400","Wedbush analyst Daniel Ives downgraded shares of Tesla Inc.  to neutral from outperform following the company's first-quarter earnings report, in which the company posted a sizable loss.",Negative,Tesla stock downgraded at Wedbush after earnings 'debacle',TSLA
1536,"Thu, 25 Apr 2019 07:14:39 -0400","The deadline for Tesla's Elon Musk's contempt of court dispute to be resolved is today, but there's a chance it could be extended yet again.",Negative,Tesla is offering insurance to leverage its autopilot technology,TSLA
1537,"Thu, 25 Apr 2019 07:00:15 -0400","Christopher Eberle, Nomura Instinet, talks Tesla earnings, production, and what to expect",Neutral,Eberle: Hold on Tesla,TSLA
1538,"Thu, 25 Apr 2019 06:15:32 -0400","Tesla posted relatively poor earnings. However, if the number of cars an auto company sells is a major key to success, Tesla continues to be on the right road.",Positive,"Tesla Still Plans to Deliver as Many as 400,000 Cars This Year",TSLA
1539,"Thu, 25 Apr 2019 03:30:47 -0400","Tesla, Inc (TSLA) CEO Elon Musk on Q1 2019 Results - Earnings Call Transcript",Neutral,"Tesla, Inc (TSLA) CEO Elon Musk on Q1 2019 Results - Earnings Call Transcript",TSLA
1540,"Wed, 24 Apr 2019 20:01:00 -0400",Deliveries are soaring and management is guiding for more big growth. But the automaker's first quarter included its fair share of challenges.,Negative,Tesla Earnings: Cash and Cash Equivalents Take a Hit,TSLA
1541,"Wed, 24 Apr 2019 19:50:00 -0400",Tesla executives cautioned investors on a quarterly call that the EV maker won’t return to profitability until the second half of 2019.,Neutral,Tesla braces investors for another quarter in the red,TSLA
1542,"Wed, 24 Apr 2019 19:23:43 -0400",Musk famously tweeted in August 2018 that he was considering taking Tesla private and had “funding secured.,Neutral,Elon Musk on taking Tesla private: ‘That ship has sailed’,TSLA
1543,"Wed, 24 Apr 2019 18:51:26 -0400","Tesla is developing an insurance product, which could be launched in about a month, CEO Elon Musk said during a call with analysts Wednesday following its first-quarter earnings report.",Positive,Tesla plans to launch an insurance product ‘in about a month’,TSLA
1544,"Wed, 24 Apr 2019 18:28:26 -0400","Tesla explains its big miss on the top and bottom. And Gene Munster, Loup Ventures, offers a deep dive into the numbers.",Neutral,Tesla explains loss during quarter,TSLA
1545,"Wed, 24 Apr 2019 18:26:11 -0400","Even as its solar business declined in step with its overall earnings, Tesla is bullish on the prospects for the energy side of its business over the course of the year.",Positive,"Despite declines for the quarter, Tesla is bullish on its overall energy business",TSLA
1546,"Wed, 24 Apr 2019 18:20:00 -0400","When asked during a Wednesday earnings call if Tesla is considering launching an insurance program, Musk says the company is working on one.",Positive,Elon Musk says Tesla will launch an insurance product in about a month,TSLA
1547,"Wed, 24 Apr 2019 18:16:19 -0400",FBN’s Jackie DeAngelis reports on Tesla’s first-quarter earnings.,Negative,Tesla stock trades slightly higher after Q1 earnings miss,TSLA
1548,"Wed, 24 Apr 2019 18:13:38 -0400","Tesla Inc. could return to profits by the third quarter, Chief Financial Officer Zachary Kirkhorn said in a call with analysts Wednesday.",Negative,"Tesla to return to profits in third quarter, CFO says",TSLA
1549,"Wed, 24 Apr 2019 18:11:10 -0400",Tesla announces a big miss on the top and bottom line. And Loup Ventures' Gene Munster reacts to Tesla's earnings.,Negative,"Tesla loses $2.90/share, revenue light, as well",TSLA
1550,"Wed, 24 Apr 2019 17:55:13 -0400","Tesla Inc. is creating an insurance program and hopes to offer it in about a month, Chief Executive Elon Musk said in a conference call with analysts after the Silicon Valley car maker's first-quarter results.",Positive,"Tesla to offer insurance in about a month, Musk says",TSLA
1551,"Wed, 24 Apr 2019 17:46:05 -0400","More than half of Tesla Inc. first-quarter deliveries occurred in the last 10 days of the quarter, Chief Executive Elon Musk said in a call with analysts after the Silicon Valley car maker's results.",Negative,Tesla's Musk: More than half of Q1 deliveries took place in last 10 days of quarter,TSLA
1552,"Wed, 24 Apr 2019 17:36:17 -0400",Tesla Inc missed top- and bottom-line Street estimates in its first-quarter report Wednesday.,Negative,Tesla's Q1 Falls Short Of The Street's Low Expectations,TSLA
1553,"Wed, 24 Apr 2019 17:35:10 -0400","Tesla earnings reported after the market close Wednesday missed widely, as revenue also fell short, though it ended the quarter with $2.2 billion of cash and cash equivalents.",Negative,"Tesla Earnings Miss By Wide Margin, Revenue Falls Short",TSLA
1554,"Wed, 24 Apr 2019 17:32:59 -0400","Tesla reported Wednesday wider-than-expected loss of $702 million, or $4.10 a share, in the first quarter after disappointing delivery numbers, costs and pricing adjustments to its vehicles threw the automaker off of its profitability track.",Negative,Tesla reports $702 million loss in first quarter,TSLA
1555,"Wed, 24 Apr 2019 16:45:00 -0400","When it comes to how autonomous cars ""see,"" Elon Musk hates lidar. Tesla takes a different tech approach.",Negative,Tesla Declares War on Waymo's Lidar Technology,TSLA
1556,"Wed, 24 Apr 2019 16:43:00 -0400",Tesla and NVIDIA are racing towards a self-driving-vehicle future -- but their paths have now diverged.,Neutral,"NVIDIA Calls Elon Musk's Self-Driving Car Comments Unfair, Inaccurate",TSLA
1557,"Wed, 24 Apr 2019 16:05:28 -0400","Tesla should see a record net losses of -$3.5bn in 2019 due to deteriorating demand and profitability of its Models S/X, which generated over 67% of 2018 gross profit.",Neutral,Tesla Should See 2019 Net Loss Of $3.5bn,TSLA
1558,"Wed, 24 Apr 2019 15:30:00 -0400","After lackluster Model 3 deliveries, Tesla is expected to post a loss of 69 cents per share on revenue of $5.2 billion for Q1 2019, according to a consensus of analysts surveyed by Refinitiv.",Negative,Tesla's set to report first-quarter earnings after the bell. Here's what we know,TSLA
1559,"Wed, 24 Apr 2019 15:20:00 -0400",Tesla conducted an event on April 22 to demonstrate and explain Tesla’s autonomous driving technology and strategy.,Positive,Tesla: Why Did The Autonomy Vehicle Day Turn Me Bullish?,TSLA
1560,"Wed, 24 Apr 2019 13:05:40 -0400",Tesla is scheduled to release its most recent quarterly results after the markets close on Wednesday.,Neutral,What to Expect When Tesla Releases Q1 Results After the Close,TSLA
1561,"Wed, 24 Apr 2019 11:42:09 -0400","Myles Udland, Dan Roberts and Heidi Cheung of Yahoo Finance discuss the latest news on Tesla ahead of the company's earnings call.",Positive,"Tesla set to reintroduce Model S and Model X, Musk says Tesla not expected to be profitable",TSLA
1562,"Wed, 24 Apr 2019 11:33:32 -0400",Tesla Inc. shifts into the earnings lane after the closing bell Wednesday with Q1 results that many analysts expect to be as inspiring as a flat tire­—and that’s after a couple weeks of rough riding.,Negative,Could Tesla Earnings Surprise Wall Street?,TSLA
1563,"Wed, 24 Apr 2019 11:14:57 -0400",April is off to a horrible start for Tesla in the countries in Europe where we get daily sales (registration) data: Norway and The Netherlands.,Negative,Tesla's Model 3 Sales Fall 82% In Norway And 76% In The Netherlands,TSLA
1564,"Wed, 24 Apr 2019 09:35:56 -0400","Paul Meeks, lead portfolio manager at The Wireless Fund, joins ""Squawk Box"" to give a preview of what he expects from Tesla earnings.",Negative,What to watch ahead of the open: Tesla,TSLA
1565,"Wed, 24 Apr 2019 09:27:00 -0400",Tesla prepares to report earnings after a quarter full of mixed messages and volatile stock price action.,Negative,Wall Street Expects Tesla Q1 Loss; Awaits Word On Company's Cash Position,TSLA
1566,"Wed, 24 Apr 2019 07:49:02 -0400","On CNBC's ""Options Action,"" Dan Nathan spoke about unusually high options activity in Tesla (NASDAQ: TSLA) ahead of earnings.",Neutral,Dan Nathan Sees Unusual Options Activity In Tesla,TSLA
1567,"Wed, 24 Apr 2019 07:30:00 -0400","Tesla investors await updates on service improvements, the Shanghai Gigafactory and Model 3 margins.",Neutral,"Tesla investors await updates from Elon Musk on service, the Shanghai factory and Model 3 margins",TSLA
1568,"Tue, 23 Apr 2019 23:56:00 -0400","Tesla, struggling with delay in delivery of its higher-priced Model S and X luxury cars, said on Tuesday it will bring back lower-priced options for those cars and roll out upgrades to improve their driving range and re-charging speed.",Positive,"Tesla upgrades Model S and Model X cars, brings back cheaper variants",TSLA
1569,"Tue, 23 Apr 2019 17:00:00 -0400",Even the biggest supporters of hydrogen vehicles are now turning to electric vehicles.,Positive,Hydrogen Cars Appear Dead as EVs Take the Reins,TSLA
1570,"Tue, 23 Apr 2019 16:57:27 -0400","After a rough start to 2019, Tesla Inc. investors have a key fundamental catalyst on the horizon this week when the company reports its first-quarter earnings on Wednesday.",Neutral,Technical Levels To Watch Ahead Of Tesla's Q1 Earnings,TSLA
1571,"Tue, 23 Apr 2019 14:50:00 -0400","The event served as a distraction from Tesla's recent operational, regulatory and financial troubles, which will be in full focus during the company's first-quarter earnings report on Wednesday.",Neutral,"Elon Musk emailed employees about how great Tesla's autonomy day was, but the plan has lots of holes",TSLA
1572,"Tue, 23 Apr 2019 13:59:39 -0400","Following its daylong presentation on autonomous cars Monday, Tesla will report first-quarter earnings after the market close Wednesday, with analysts concerned over downbeat results.",Negative,What To Expect When Tesla Reports First-Quarter Earnings,TSLA
1573,"Tue, 23 Apr 2019 12:55:25 -0400","Elon Musk claims Tesla will have 1 million robotaxis on roads next year, but warns he's missed the mark before.",Positive,Elon Musk says Tesla will have 'robotaxis' on the road by 2020,TSLA
1574,"Tue, 23 Apr 2019 12:46:57 -0400","Visionary Tesla, Inc. CEO Elon Musk on Monday laid out an extremely optimistic timetable for Tesla’s autonomous vehicle technology at the company’s Autonomy Investor Day event.",Neutral,Wall Street Weighs In On Tesla's Autonomy Day Presentation,TSLA
1575,"Tue, 23 Apr 2019 12:45:00 -0400","The electric-car company's cash, vehicle demand, and outlook for profitability will give investors key insight into its performance.",Neutral,Tesla Earnings: 3 Metrics to Watch,TSLA
1576,"Tue, 23 Apr 2019 12:32:26 -0400","Daniel Ives, managing director of equity research at Wedbush, previews first-quarter results for Tesla Inc. He speaks with Bloomberg's David Westin on ""Bloomberg Daybreak: Americas.",Neutral,"Tesla, Musk Could Face 'Most Pivotal' Earnings in 1Q, Ives Says",TSLA
1577,"Tue, 23 Apr 2019 12:32:25 -0400","Pierre Ferragu of New Street Research and Rajvindra Gill of Needham join CNBC's ""Squawk Alley"" team to discuss Elon Musk's claim that there will be one million robotaxis on the road by 2020.",Neutral,"Elon Musk's robotaxis still have major hurdles, says analyst",TSLA
1578,"Tue, 23 Apr 2019 12:31:27 -0400",Tesla Inc. hosted an investor day on Monday to showcase the progress of its self-driven vehicle technology.,Negative,The Key Takeaways From Tesla's Autonomy Investor Day,TSLA
1579,"Tue, 23 Apr 2019 12:19:51 -0400","Dan Roberts, Myles Udland and Melody Hahm of Yahoo Finance discuss the latest statements by Tesla CEO Elon Musk about robot taxis.",Positive,Elon Musk promises robot taxis by next year,TSLA
1580,"Tue, 23 Apr 2019 11:14:00 -0400","In a sign of how fast things are changing, two of the three finalists for World Car of the Year at the 2019 New York show were fully electric with the Jaguar I-Pace taking Car of the Year, World Car Design and World Green Car for 2019.",Neutral,New York auto show previews Tesla's future competition with more than 40 electrified vehicles,TSLA
1581,"Tue, 23 Apr 2019 10:24:11 -0400",Musk's insisted that Tesla's new microchip is objectively the best chip in the world.,Positive,Elon Musk Claims On Tesla's Autonomous Capabilities Does Not Reflect Its Current Reality,TSLA
1582,"Tue, 23 Apr 2019 10:09:12 -0400","CNBC's Jim Cramer gives his first take on Tuesday's earnings from companies United Tech, Twitter, Procter & Gamble, and Elon Musk's comments during Tesla's investor day.",Neutral,Cramer's First Take,TSLA
1583,"Tue, 23 Apr 2019 09:27:07 -0400","Tesla CEO Elon Musk announced at an investor event that the company will have robotaxis on the road within the next year. Tim Higgins, a reporter with the Wall Street Journal, joins ""Squawk Box"" along with CNBC's Phil LeBeau to discuss.",Neutral,Here's what happened at Tesla's investor day and what it means for the stock,TSLA
1584,"Tue, 23 Apr 2019 08:31:00 -0400","On Tesla Autonomy Investor Day, CEO Elon Musk was all too confident about carrying out autonomous robotaxis next year.",Negative,"Wall Street calls Tesla’s autonomous plan ‘half-baked,’ doubts it can beat Lyft, Nvidia and Google",TSLA
1585,"Tue, 23 Apr 2019 08:28:29 -0400",Not even news of autonomous robotaxis could steer Tesla Inc (NASDAQ: TSLA)'s stock straight after a weekend Model S explosion and board shakeup.,Negative,Tesla Forecasts Autonomous Robotaxis In 2020,TSLA
1586,"Tue, 23 Apr 2019 07:16:55 -0400","At Tesla's autonomy investor day event, Elon Musk made a bold promise: that there would be a million Tesla robo-taxis on the road within the next year. CNBC's Phil LeBeau reports on the highlights from the event.",Positive,Tesla's Elon Musk promises 'robo-taxis' by 2020,TSLA
1587,"Tue, 23 Apr 2019 06:59:00 -0400","""It's financially insane to buy anything other than a Tesla,"" says the CEO of the electric auto maker.",Positive,Elon Musk: Any other car than a Tesla in 3 years will be like 'owning a horse',TSLA
1588,"Mon, 22 Apr 2019 21:00:00 -0400",These stocks could drive immense gains for your portfolio.,Positive,3 Top Driverless-Car Stocks to Watch in April,TSLA
1589,"Mon, 22 Apr 2019 18:56:46 -0400","FoxNews.com columnist Liz Peek, FBN’s Kristina Partsinevelos, Capitalist Pig hedge fund manager Jonathan Hoenig and Kaltbaum Capital Management President Gary Kaltbaum discuss the problems surrounding Tesla ahead of its earnings release.",Negative,Tesla CEO Elon Musk touts robot cars amid sales slump,TSLA
1590,"Mon, 22 Apr 2019 18:16:16 -0400",Tesla shakes up its board. Is there more trouble ahead for the electric automaker?,Neutral,Tesla is shaking up its board of directors--what does it mean for Musk?,TSLA
1591,"Mon, 22 Apr 2019 17:47:54 -0400",Tesla (TSLA) touted its self-driving advances Monday but a sinking Tesla stock made the case for putting investing on autopilot.,Neutral,Dow Jones Futures: The Tesla Case For Autopilot Investing,TSLA
1592,"Mon, 22 Apr 2019 17:19:57 -0400","Jim Press, former president of Chrysler, and Steven Shladover, research engineer at University of California-Berkeley, join ""Closing Bell"" to discuss the strides Tesla has made in the area of driverless tech.",Neutral,"Expect NHTSA to be strict with driverless cars, says expert",TSLA
1593,"Mon, 22 Apr 2019 17:09:00 -0400","Tesla CEO Elon Musk said on Monday that he's ""very confident"" predicting autonomous robotaxis will hit the market in 2020.",Positive,Elon Musk says Tesla robotaxis will hit the market next year,TSLA
1594,"Mon, 22 Apr 2019 16:25:06 -0400","Tesla Inc. Chief Executive Elon Musk said the company is expecting to get some regulatory approval for its self-driving cars, at least in some places, as early as the end of 2020.",Positive,Musk: Tesla to start getting some regulator approval for self driving by end of 2020,TSLA
1595,"Mon, 22 Apr 2019 15:07:26 -0400","Tesla Inc. stock held to losses around 3.6% as the company's investor day, solely focused on its autonomous driving capabilities, is under way.",Positive,"Tesla unveils in-house driverless-car hardware, 'best in the world'",TSLA
1596,"Mon, 22 Apr 2019 14:54:46 -0400","CNBC's ""Power Lunch"" team is joined by Paul Ingrassia, Revs Institute for Automotive Research editor, and Joe Osha, JMP Securities Tesla analyst, to discuss Tesla's latest updates on its driverless vehicle technology and a video of an apparent Tesla Model S explosion in Shanghai.",Negative,"Tesla looks toward future instead of focusing on present problems, says pro",TSLA
1597,"Mon, 22 Apr 2019 14:26:54 -0400","Charley Grant, WSJ, and CNBC's Phil LeBeau join 'The Exchange' to discuss Tesla shares falling after Evercore downgraded the stock. They also discuss what they're expecting for the company's earnings.",Neutral,"Investors should focus on Tesla earnings, not downgrade, says expert",TSLA
1598,"Mon, 22 Apr 2019 12:50:18 -0400",Shares pledged as collateral dips at end of 2018.,Neutral,Tesla: Elon Musk Borrowing Update,TSLA
1599,"Mon, 22 Apr 2019 12:30:55 -0400",Tesla among others continues to ridicule Toyota for its focus on non-BEV technologies.,Neutral,"A Little Perspective Please - Toyota, Tesla And Others",TSLA
1600,"Mon, 22 Apr 2019 12:26:38 -0400","Apr.22 -- Mark Lehmann, president at JMP Securities, examines the issues faced by Tesla Inc. ahead of a new product announcement and its quarterly earnings report on Wednesday.",Negative,"Tesla Adds China Car Fire, Battery Battle to Product News, Earnings",TSLA
1601,"Mon, 22 Apr 2019 11:49:25 -0400","Myes Udland, Dan Roberts and Melody Hahm of Yahoo Finance discuss the public spat on Twitter between Elon Musk and Panasonic.",Negative,Elon Musk tweets Panasonic operates at 'reduced pace' and 'slows down production',TSLA
1602,"Mon, 22 Apr 2019 11:30:58 -0400","Tesla is hosting Autonomy Day on Monday, an event to showcase its self-driving vehicle technology and coming just ahead of its first-quarter earnings, which is expected to show a loss.",Positive,Tesla Autonomy Day Arrives As Analysts Fret Over First-Quarter Earnings,TSLA
1603,"Mon, 22 Apr 2019 10:17:28 -0400","Craig Irwin, senior research analyst at Roth Capital Partners, discusses comments from Elon Musk about Panasonic Corp., the supplier of lithium-ion battery cells that power Tesla Inc.'s electric vehicles. He speaks on ""Bloomberg Daybreak: Americas.""",Negative,Musk Takes Aim at Panasonic Over Tesla Battery Production,TSLA
1604,"Mon, 22 Apr 2019 10:06:32 -0400","Tesla saw 1Q deliveries fall short of expectations, leading to demand concerns. The key question is whether this is a temporary blip or an ongoing structural issue.",Neutral,"Tesla's Q1 Issues Reduce Demand Visibility, But Long-Term Demand Still Appears Healthy",TSLA
1605,"Mon, 22 Apr 2019 10:00:47 -0400","Rick Newman, Brian Sozzi and Alexis Christoforous discuss Elon Musk's plans to roll out driverless technology for Tesla.",Neutral,Is Tesla going too far and too fast with driverless technology?,TSLA
1606,"Mon, 22 Apr 2019 09:20:07 -0400","Tesla Inc. is scheduled to release its most recent quarterly results later this week, but there are already concerns from analysts and investors alike.",Negative,Why One Key Analyst Has Soured on Tesla Ahead of Q1 Results,TSLA
1607,"Mon, 22 Apr 2019 09:12:43 -0400","Tesla said its directors reviewed the composition of the board ""focusing on a phased streamlining of the size of the Board to allow it to operate more nimbly and efficiently."" Bob Lutz, former vice chairman of General Motors, joins ""Squawk Box"" to discuss the move.",Negative,Former GM Chair Bob Lutz weighs in on the changes to the Tesla board,TSLA
1608,"Mon, 22 Apr 2019 08:55:56 -0400",Tesla says it immediately sent a team to investigate an apparent explosion of one of its cars that occurred in Shanghai on Sunday evening local time. CNBC's Phil LeBeau reports.,Negative,Here's why some think the Tesla explosion video is suspect,TSLA
1609,"Mon, 22 Apr 2019 08:55:56 -0400",Tesla Inc (NASDAQ: TSLA) traded down Monday morning as investors took note of a couple updates over the three-day weekend.,Negative,"Tesla's Weekend Starts With Board Shakeup, Ends With Car Explosion",TSLA
1610,"Mon, 22 Apr 2019 08:17:00 -0400","Evercore downgraded Tesla to ""underperform"" from ""in-line"" on Monday.",Negative,Tesla downgraded at Evercore on slowing demand across all models,TSLA
1611,"Mon, 22 Apr 2019 07:41:00 -0400",Energy generation and storage revenues of Tesla (TSLA) for first-quarter 2019 are likely to remain strong.,Neutral,Tesla (TSLA) to Report Q1 Earnings: What's in the Cards?,TSLA
1612,"Mon, 22 Apr 2019 06:50:35 -0400","Tesla said its directors reviewed the composition of the board ""focusing on a phased streamlining of the size of the Board to allow it to operate more nimbly and efficiently."" CNBC's ""Squawk Box"" discusses the company's decision.",Neutral,Tesla to shrink board from 11 members to seven,TSLA
1613,"Mon, 22 Apr 2019 06:36:05 -0400","Tesla says it immediately sent a team to investigate an apparent explosion of one of its cars that occurred in Shanghai on Sunday evening local time. CNBC's ""Squawk Box"" discusses.",Neutral,Tesla to investigate apparent Model S explosion in China,TSLA
