,date,text,sentiment,title,Ticker
1029,"Wed, 26 Jun 2019 12:03:22 -0400","Tesla Inc's vice president of production at its Fremont factory, Peter Hochholdinger, has left after three years with the electric-car maker, a source familiar with the matter told Reuters.",Negative,Tesla's senior production executive at Fremont facility quits: source,TSLA
1030,"Wed, 26 Jun 2019 11:35:00 -0400","Tesla is working on new battery cell designs, and a way to make their own cells, with R&D teams in a lab near its car plant in Fremont, California.",Neutral,Tesla has a secret lab trying to build its own battery cells to reduce dependence on Panasonic,TSLA
1031,"Wed, 26 Jun 2019 11:12:13 -0400","It’s been a brutal year for Tesla, Inc (NASDAQ: TSLA), and one analyst said on Wednesday he's lowering expectations for next week’s second-quarter Tesla deliveries numbers.",Negative,Wedbush Lowers Tesla Q2 Delivery Estimate,TSLA
1032,"Wed, 26 Jun 2019 11:10:04 -0400","Yahoo Finance's Dan Roberts, Myles Udland and Dan Roberts discuss the email Tesla CEO Elon Musk sent out to ask employees to help meet delivery goals between 90,000 and 100,000.",Neutral,Elon Musk calls on employees to help exceed delivery expectations,TSLA
1033,"Wed, 26 Jun 2019 10:04:18 -0400","In a leaked email, Tesla Inc (NASDAQ: TSLA) CEO Elon Musk said the electric carmaker is near to setting a record vehicle delivery number for a single quarter, and said delivery logistics are key, according to Business Insider.",Positive,Leaked Email From Tesla's Musk Says Automaker Approaching Record Vehicle Delivery Number,TSLA
1034,"Tue, 25 Jun 2019 23:17:00 -0400","Tesla CEO Elon Musk sent out another email to his employees, pushing them to aim for a record number of vehicle deliveries to end the second quarter of 2019.",Neutral,"Read the email from Elon Musk to Tesla employees, pushing them to hit aggressive goals",TSLA
1035,"Tue, 25 Jun 2019 15:28:16 -0400","Shares of Tesla Inc fell 1.3% on Tuesday after news website Electrek reported that the electric-car maker has so far delivered 49,000 vehicles in North America during the second quarter and may miss its quarterly target.",Negative,Tesla likely to miss record second-quarter delivery target: Electrek,TSLA
1036,"Tue, 25 Jun 2019 14:26:00 -0400","Car and Driver said Tesla's Model 3 was the best-selling luxury car in America for 2018. But only 10 states allow Tesla's direct sales model, 11 states have banned it, and many states restrict Tesla to just a few stores.",Positive,Tesla Beating Competitors Even With Its Hands Tied,TSLA
1037,"Tue, 25 Jun 2019 13:20:46 -0400","Markets have high expectations for TSLA. It might exceed them in the quarter, boosting Tesla stock towards analysts' average price target.",Positive,Tesla’s Results to Be Pivotal for TSLA Stock,TSLA
1038,"Tue, 25 Jun 2019 12:00:40 -0400","Lithium stocks have tanked due to negative analyst sentiment, but that makes now a great time to consider a contrarian move.",Positive,Lithium Stocks to Buy Despite the Market’s Irrationality,TSLA
1039,"Tue, 25 Jun 2019 07:00:11 -0400","Increasingly, the companies that we cover on Wall Street are starting to agree that while the future is still bright for the U.S.",Positive,Jefferies Top Growth Stocks to Buy All Have Big-Time Catalysts,TSLA
1040,"Mon, 24 Jun 2019 19:32:46 -0400","The exclusion is good for 10,000 tons of Japanese aluminum but is only valid for a year.",Positive,"Tesla wins a tariff exemption on imported aluminum, for now",TSLA
1041,"Mon, 24 Jun 2019 17:37:25 -0400","Tesla Inc. TSLA, +0.80% was granted a waiver on 10% tariffs on aluminum imported from Japan, according to a Reuters report Monday.",Positive,Tesla granted waiver on 10% tariffs against Japanese aluminum: report,TSLA
1042,"Mon, 24 Jun 2019 16:38:11 -0400",CNBC's Kayla Tausche reports on Tesla's long-awaited approval for exclusion from tariffs on aluminum coming from Japan.,Positive,Tesla wins tariff exclusion on imported aluminum from Japan,TSLA
1043,"Mon, 24 Jun 2019 15:39:00 -0400",Tesla has won a tariff exclusion from the U.S. Commerce Department on the imported Japanese aluminum it uses in its battery cells.,Positive,Tesla wins tariff exclusion from US on imported aluminum,TSLA
1044,"Mon, 24 Jun 2019 15:22:02 -0400","The U.S. Commerce Department has agreed to Tesla Inc's request to waive 10 percent tariffs on imported aluminum from Japan used in the manufacture of battery cells at Tesla's Nevada Gigafactory, government documents show.",Positive,U.S. waives tariffs on Japanese aluminum for Tesla battery cells,TSLA
1045,"Mon, 24 Jun 2019 12:10:30 -0400",Tesla’s stock dropped from its peak $387 to the recent $176 low in May 2019. We believe the market showed worry about the effectiveness of recent strategies.,Negative,Eyes On Tesla's Unit Cost And Ads ROI,TSLA
1046,"Mon, 24 Jun 2019 10:33:17 -0400",The recent relief rally in Tesla stock won't provide any long-term relief. Time to short TSLA on any strength.,Negative,Tesla Stock Is Back Above $200 — Time To Short It,TSLA
1047,"Sun, 23 Jun 2019 20:50:06 -0400","Currently, there is no cheap or similarly priced EV that is able to compete with the Model 3.",Positive,Tesla's Model 3: Demand Is High,TSLA
1048,"Sun, 23 Jun 2019 09:01:00 -0400",You might think our third contributor has lost his mind.,Positive,Three Top Value Stocks to Buy Right Now,TSLA
1049,"Sat, 22 Jun 2019 12:30:18 -0400","Over the past six months Tesla’s shares have continued to move lower, looking like a slinky bouncing down the stairs. The stock had gotten very oversold when it hit $179 three weeks ago and was due for a rebound.",Negative,Beware Of Tesla’s Latest Dead Cat Bounce,TSLA
1050,"Sat, 22 Jun 2019 11:45:00 -0400",Expect huge growth both sequentially and year over year.,Neutral,How Many Vehicles Will Tesla Deliver in Q2?,TSLA
1051,"Sat, 22 Jun 2019 08:00:06 -0400",Playing Beach Buggy Racing 2 in a brand-new Model S Long Range makes a passable game pretty darned fun.,Neutral,The Tesla Model S is an excellent video game controller     - Roadshow,TSLA
1052,"Fri, 21 Jun 2019 14:17:54 -0400","Tesla bears dominated the headlines yesterday. Today, the bulls got a chance to weigh in.",Neutral,Negative Analyst Notes Both Hurt -- and Help -- Tesla Stock,TSLA
1053,"Fri, 21 Jun 2019 13:28:48 -0400","Tesla, Inc. (NASDAQ: TSLA) has faced a rough 2019 with a fatal autopilot accident and some analysts calling for its demise, but this could all change, according to a couple of different reports that became public on Friday.",Positive,Why These Two Analysts See Massive Upside for Tesla,TSLA
1054,"Fri, 21 Jun 2019 12:51:07 -0400","Surprises and missed expectations set off a sharp plunge in Tesla stock this year, which is down about 34%, as Wall Street analysts have expressed mixed views on whether Tesla stock is a buy or sell.
The post Wall Street Struggles With How It Should Value Tesla Stock appeared first on Investor's Business Daily.",Negative,Wall Street Struggles With How It Should Value Tesla Stock,TSLA
1055,"Fri, 21 Jun 2019 08:34:38 -0400","Investor sentiment on Tesla Inc. TSLA, -3.01% appears to have ""overshot to the negative,"" said analyst Ben Kallo at Baird, who said he believes there are several upcoming catalysts that could drive the electric vehicle maker's stock higher.",Negative,"Tesla sentiment has 'overshot to the negative,' says Baird",TSLA
1056,"Fri, 21 Jun 2019 06:37:24 -0400","TSLA stock is worth anything between $140 and $585 … a huge disparity driven by the fact that Tesla is unlike anything anyone's ever had to judge before.
The post Morgan Stanley Perfectly Sums Up the Dilemma For Tesla Stock Investors appeared first on InvestorPlace.",Negative,Morgan Stanley Perfectly Sums Up the Dilemma For Tesla Stock Investors,TSLA
1057,"Thu, 20 Jun 2019 18:55:06 -0400",A new wave of behind the wheel gameplay is coming to Tesla.,Neutral,New Tesla Arcade Game Hands-On: Beach Buggy Racing 2,TSLA
1058,"Thu, 20 Jun 2019 15:26:25 -0400",Yahoo Finance's Seana Smith and Brian Sozzi discuss the challenges facing Tesla and why Goldman Sachs lowered its price target.,Negative,Goldman Sachs lowers Tesla price target by 30%,TSLA
1059,"Thu, 20 Jun 2019 15:21:00 -0400",Demand concerns once again take the spotlight.,Negative,1 Analyst Thinks Tesla Stock Will Fall 28%,TSLA
1060,"Thu, 20 Jun 2019 14:33:21 -0400",Tesla Inc (NASDAQ: TSLA) shares fell Thursday after Goldman Sachs cut its price target from $200 to $158.,Negative,Tesla Falls After Goldman Sachs Cuts Price Target,TSLA
1061,"Thu, 20 Jun 2019 12:51:49 -0400","What's in a name? A lot, apparently.",Neutral,"Drivers assume Tesla's Autopilot offers more leeway than it does, IIHS study finds",TSLA
1062,"Thu, 20 Jun 2019 12:32:00 -0400","Tesla has recently released hardware upgrades to the Model S and Model X, improving the quality of the vehicle, and more are likely on the way.",Positive,Tesla's Model S And X: Demand To Rebound,TSLA
1063,"Thu, 20 Jun 2019 10:38:28 -0400","Goldman Sachs on Thursday cut its price target on Tesla Inc by 21%, to third lowest on the Street, on concerns about the sustainability of demand for the electric car maker's models.",Negative,Goldman slashes Tesla price target by $42 on demand concerns,TSLA
1064,"Thu, 20 Jun 2019 08:27:03 -0400","Tesla Inc. shares TSLA, +0.75% fell 1.5% in premarket trade Thursday, after Goldman Sachs slashed its stock price target to $158 from $200 on concerns the company can meet estimates for the second half and beyond.",Negative,Tesla shares slide premarket as Goldman Sachs slashes price target to $158 from $200,TSLA
1065,"Thu, 20 Jun 2019 08:22:00 -0400","Almost 40,000 people die each year in the United States mostly due to automotive accidents. Self-driving cars are expected to bring down the numbers.",Positive,Make Way for Driverless Cars: Top 5 Gainers,TSLA
1066,"Thu, 20 Jun 2019 08:00:52 -0400","Tesla stock recently fell to levels not seen since early in 2016. But with rapid growth in shipments, what do the fundamentals and technical analysis say about buying Tesla shares?",Negative,"Is Tesla Stock A Buy Right Now? Here's What Earnings, Charts Show",TSLA
1067,"Thu, 20 Jun 2019 06:33:00 -0400",Goldman Sachs lowered its price target on Tesla over concerns about demand.,Negative,Goldman Sachs cuts Tesla price target: 'Downward path for shares will resume',TSLA
1068,"Wed, 19 Jun 2019 18:48:48 -0400","A first-quarter filing showed that noted short-seller Jim Chanos (Trades, Portfolio)’ long purchases during the period comprised only exchange-traded funds, mostly those tracking small and mid-cap stocks and companies in China.",Negative,"Short-Seller Jim Chanos Buys Small-Cap, China ETFs and Tesla",TSLA
1069,"Wed, 19 Jun 2019 17:46:20 -0400","Tesla will start charging $1,000 for its once-standard black paint color next month, according to a tweet Wednesday by CEO Elon Musk, the latest pricing adjustment by the automaker as it aims for profitability. Basic white will become the new (and only) free standard paint color, Musk added in a followup tweet.",Negative,"Why all standard black Tesla cars are about to cost $1,000 more",TSLA
1070,"Wed, 19 Jun 2019 15:40:11 -0400","Ross Gerber, Gerber Kawasaki President and CEO, talks about why he's a bull on Tesla stock. He appears on ""Bloomberg ETF IQ.""",Negative,Lots of Companies Are Trying to Hurt Tesla Says Bull Ross Gerber,TSLA
1071,"Wed, 19 Jun 2019 14:31:00 -0400","To make good investments, it helps to discuss your ideas with people whose opinions evolve as new facts come out. This is especially true about Tesla which tends to bring out strong opinions from bulls and bears.",Positive,Tesla Bear Impressed With Model 3 Build Quality,TSLA
1072,"Wed, 19 Jun 2019 13:02:00 -0400","Self-driving cars represent a massive market opportunity, and right now, beleaguered automaker Tesla is leading the charge, says Ark's Tasha Keeney.",Positive,Tesla has a 'great lead' in this $2 trillion market opportunity: Analyst,TSLA
1073,"Wed, 19 Jun 2019 09:54:00 -0400",Tesla shares are nearing Morgan Stanley's price target but the firm isn't sure how to tell investors to value Elon Musk's company.,Neutral,Morgan Stanley isn't sure how to value Tesla anymore,TSLA
1074,"Tue, 18 Jun 2019 22:38:10 -0400","Tesla Arcade is pulling the company’s secret video game features out of the shadows and bringing them front and center, starting today.",Neutral,Tesla Arcade hands-on: the Model 3 is your video game console,TSLA
1075,"Tue, 18 Jun 2019 19:06:00 -0400","Tesla loses vice president of HR and head of diversity, Felicia Mayo, one of a few black woman executives to break Silicon Valley's glass ceiling.",Negative,Tesla loses HR vice president and head of diversity Felicia Mayo,TSLA
1076,"Tue, 18 Jun 2019 16:19:09 -0400",Tesla might not engage in traditional advertising. That doesn’t mean the automaker isn’t keen on getting new customers and retaining the ones it already has.,Positive,Tesla is turning its showrooms into arcades,TSLA
1077,"Tue, 18 Jun 2019 15:51:23 -0400",The game will be playable with the car's controls while the vehicle is charging.,Positive,Tesla rolls out Beach Buggy Racing 2 game to its cars     - Roadshow,TSLA
1078,"Tue, 18 Jun 2019 14:32:00 -0400",Tesla investors are regaining confidence in a quieter Elon Musk — even as they question the company's ability to hit its production goals for the second quarter.,Positive,Tesla investors regain confidence in a quieter Elon Musk as all eyes turn to production,TSLA
1079,"Tue, 18 Jun 2019 13:52:03 -0400","Investors today should evaluate Tesla as a fast-growing car stock, one that is leading the race in design but having real trouble making money consistently.
The post Tesla: Car Stock or Tech Stock?",Neutral,Tesla: Car Stock or Tech Stock?,TSLA
1080,"Tue, 18 Jun 2019 13:23:33 -0400","Tesla Inc (NASDAQ: TSLA) CEO Elon Musk has previously told employees they need to consistently produce 1,000 Model 3 sedans per day for the rest of the quarter to set a new record for vehicle deliveries.",Negative,Report: Tesla May Fall Short Of Record Model 3 Production Goal,TSLA
1081,"Tue, 18 Jun 2019 10:31:03 -0400","TSLA popped on Monday and continues to make gains, but Elon Musk’s latest Twitter antics aren’t the only reason why.",Positive,Is Elon Musk’s Tweet the Reason Behind Tesla Stock’s Latest Jump?,TSLA
1082,"Tue, 18 Jun 2019 09:28:06 -0400","Options trading was hot in General Motors, Apple and Micron on Monday. Here’s what the data suggests moving forward.",Positive,"Tuesday’s Vital Data: Facebook, Tesla and Micron Technology",TSLA
1083,"Tue, 18 Jun 2019 08:23:43 -0400","Over the past week Tesla stock has bounced back from its recent lows, but the TSLA stock move up may not last for long.
The post Post-Annual Meeting and Pre-Q2 Results, Is Tesla Stock Worth Consideration?",Neutral,"Post-Annual Meeting and Pre-Q2 Results, Is Tesla Stock Worth Consideration?",TSLA
1084,"Mon, 17 Jun 2019 16:29:00 -0400",The new week got off to a good start for the market overall.,Positive,"Why Tesla, C&J Energy Services, and CrowdStrike Holdings Jumped Today",TSLA
1085,"Mon, 17 Jun 2019 16:05:26 -0400","Gilead Sciences, Pfizer, Tesla, Netflx and Facebook are our top stock trades for Tuesday. Here's a look at the charts.",Positive,Five Top Stock Trades for Tuesday June 18,TSLA
1086,"Mon, 17 Jun 2019 15:39:00 -0400",Is a short squeeze in the works?,Positive,Why Tesla Stock Jumped Monday,TSLA
1087,"Mon, 17 Jun 2019 09:21:11 -0400","Silicon Valley billionaire Elon Musk tweeted https://twitter.com/elonmusk/status/1140481957341495296 late on Sunday that he had ""just deleted"" his Twitter account, while also changing his Twitter display name to ""Daddy DotCom"".",Neutral,Tesla's Elon Musk becomes 'Daddy DotCom' on Twitter,TSLA
1088,"Mon, 17 Jun 2019 09:16:52 -0400","The Tesla CEO also changed his Twitter handle, but the account is still active.",Neutral,"Elon Musk says he deleted his Twitter account, and we're all confused",TSLA
1089,"Mon, 17 Jun 2019 06:55:00 -0400","Elon Musk, the CEO of Tesla and SpaceX, tweeted early on Monday morning that he ""just deleted"" his Twitter account.",Neutral,Elon Musk says he deleted his Twitter account,TSLA
1090,"Mon, 17 Jun 2019 06:50:38 -0400","After a grueling drop in TSLA stock, there has been a rally.  But it may not last.",Negative,Why the Rally of Tesla Stock Could Reverse,TSLA
1091,"Mon, 17 Jun 2019 06:05:00 -0400",Fewer tariffs are bad for some in the solar industry.,Neutral,Why Solar Stocks Are Taking Investors On a Wild Ride,TSLA
1092,"Sun, 16 Jun 2019 20:03:24 -0400","Read about some of the most important and impressive investments for Elon Musk, the visionary engineer and technology superstar.",Positive,Elon Musk's Best Investments,TSLA
1093,"Sun, 16 Jun 2019 17:15:00 -0400",The top electric-car maker's CEO has some lofty dreams.,Positive,Where Will Tesla Be in 1 Year?,TSLA
1094,"Sun, 16 Jun 2019 11:45:00 -0400",Tesla completely transformed the automotive landscape and has done more to further the electric game than anyone else.,Negative,Will Tesla Fail? | Digital Trends,TSLA
1095,"Sun, 16 Jun 2019 07:00:05 -0400",All companies need is insurance and the ability to remotely monitor the vehicle.,Positive,Florida's new bill lets driverless cars be tested with minimal restrictions     - Roadshow,TSLA
1096,"Sun, 16 Jun 2019 06:00:18 -0400","Hey, weekend readers. This is Week-in-Review where I get hopped up on caffeine and give a heavy amount of analysis on one story while scouring the rest of the hundreds of stories that emerged on TechCrunch this week to surface my favorites for your reading pleasure.",Neutral,Week-in-Review: E3’s forever franchises and Elon Musk’s submersible Tesla,TSLA
1097,"Sat, 15 Jun 2019 12:07:42 -0400","Some of the best real-time insights into Tesla and its global fleet of electric vehicles — outside the confines of its Silicon Valley headquarters — might be through the lens of TezLab, a tiny upstart in Brooklyn.",Positive,"Meet TezLab, the Fitbit for Tesla vehicles",TSLA
1098,"Fri, 14 Jun 2019 17:14:07 -0400","Berenberg auto analyst Alexander Haissl, a long-time Tesla bull, reiterated his Buy rating on Tesla’s stock and $500 price target.",Positive,Tesla bull says stock will double in the next 12 months,TSLA
1099,"Fri, 14 Jun 2019 16:24:50 -0400","Zeljko Popovic, a leader within Tesla Inc's (NASDAQ: TSL) Autopilot team, is leaving for Embark, the autonomous trucking start-up in San Francisco, CNBC is reporting.",Negative,Tesla Autopilot Leader Departing For Embark,TSLA
1100,"Fri, 14 Jun 2019 13:16:00 -0400","Tesla (TSLA) has witnessed a significant price decline in the past four weeks, and is seeing negative earnings estimate revisions as well.",Negative,Falling Earnings Estimates Signal Weakness Ahead for Tesla (TSLA),TSLA
1101,"Fri, 14 Jun 2019 11:40:08 -0400","Yahoo Finance's Kristin Myers, Heidi Cheung and Zack Guzman discuss 'Fall Out Shelter' and other video games being offered in Teslas.",Positive,Elon Musk announced he will be offering more video games in Tesla cars,TSLA
1102,"Fri, 14 Jun 2019 09:20:00 -0400",One of Wall Street's most optimistic Tesla analysts is sticking with his call for the stock to double over the next 12 months.,Positive,Monster Tesla bull is sticking by stock and sees it doubling in 12 months,TSLA
1103,"Thu, 13 Jun 2019 19:21:47 -0400",Two eccentric minds meet at E3 2019.,Neutral,Elon Musk and Bethesda's Todd Howard at E3 2019 in 12 minutes,TSLA
1104,"Thu, 13 Jun 2019 18:21:59 -0400","The Trump administration is expanding efforts to block the use of Chinese technology in advanced vehicles, denying additional requests by Tesla Inc for tariff relief on key components of its electric vehicles, and rejecting ride-hailing company Uber's petition to waive tariffs on electric scooters and at least 50 separate requests by General Motors Co.",Negative,"U.S. denies Tesla, GM, Uber 25% Chinese tariff relief",TSLA
1105,"Thu, 13 Jun 2019 17:12:17 -0400","Tesla and Uber both had requests for tariff relief rejected by U.S. trade officials, a decision that will force the companies to pay a 25% tariff or seek new suppliers.",Negative,Why Tesla and Uber won’t escape 25% tariffs — for now,TSLA
1106,"Thu, 13 Jun 2019 16:46:01 -0400","Tesla has consistently been adding software to its in-car touchscreen infotainment displays – including sometimes things that probably leave a lot of people scratching their heads. During a special Q&A today at annual gaming event E3 in LA, Tesla CEO Elon Musk revealed that Tesla’s in-car display will support YouTube someday soon.",Positive,Tesla’s in-car touchscreens are getting YouTube support,TSLA
1107,"Thu, 13 Jun 2019 15:56:00 -0400","The departure of Tesla Autopilot perception lead Zeljko Popovic comes at a critical time, as Tesla is promising its electric vehicles will be capable of operating as ""robotaxis"" by the end of next year.",Negative,Tesla loses key Autopilot engineer to self-driving truck start-up Embark,TSLA
1108,"Thu, 13 Jun 2019 15:41:43 -0400",Elon Musk came to E3 and he brought some video games.,Positive,Elon Musk announces Fallout Shelter and Cuphead for Telsa,TSLA
1109,"Thu, 13 Jun 2019 15:41:42 -0400","The Tesla Inc (NASDAQ: TSLA) Pickup truck design has been shrouded in mystery. Earlier this year, CEO Elon Musk tweeted a teaser image of the front end of the truck.",Positive,Electrek Shares Some Fan Art Of Tesla's Upcoming Pickup Truck,TSLA
1110,"Thu, 13 Jun 2019 13:16:36 -0400","The Trump administration is expanding its efforts to block the use of Chinese technology in advanced vehicles, denying additional requests by Tesla Inc for tariff relief on key components of its electric vehicles, and rejecting ride hailing company Uber's petition to waive tariffs on electric scooters.",Neutral,"U.S. denies Tesla, Uber 25% tariff relief on components, e-bikes",TSLA
1111,"Thu, 13 Jun 2019 11:24:27 -0400","The Trump administration has denied requests to exempt Tesla Inc's Model 3 from 25% tariffs on its Chinese-made car computer and center screen, according to letters seen by Reuters.",Neutral,U.S. denies Tesla tariff relief request for Chinese-made Model 3 'brain',TSLA
1112,"Thu, 13 Jun 2019 11:09:00 -0400",Tesla’s requests to waive tariffs on the car company’s China-made center screen and car computer on its Model 3 has reportedly been denied.,Negative,US reportedly denies Tesla’s request to waive tariffs on Chinese-made Model 3 parts,TSLA
1113,"Thu, 13 Jun 2019 08:22:26 -0400","Tesla CEO Elon Musk rallied shareholders at its annual meeting on Tuesday, stating the company was on track to hit its production goals and that demand was strong.",Positive,Analysts are divided on Tesla. Watch one investor make the bull case,TSLA
1114,"Wed, 12 Jun 2019 17:11:39 -0400",Tesla brings the service center to the customer with an electric fleet of Model S sedans that have been transformed into workshops on wheels.,Neutral,We ride along and fix electric cars with Tesla Mobile Service     - Roadshow,TSLA
1115,"Wed, 12 Jun 2019 16:55:58 -0400",Investors weighed Elon Musk's comments from Tesla's,Positive,Elon Musk says demand is still strong,TSLA
1116,"Wed, 12 Jun 2019 16:45:16 -0400","Dan Ives, Wedbush Securities; Joe Osha, JMP Securities; and Josh Brown, Ritholtz Wealth Management, join 'Closing Bell' to discuss Elon Musk's comments from last night's Tesla shareholder meeting.",Negative,"Very, very challenging period for Tesla: Ives",TSLA
1117,"Wed, 12 Jun 2019 13:31:00 -0400","The electric-car maker has more than enough demand for its vehicles, management says.",Positive,"Tesla: ""There Is Not a Demand Problem""",TSLA
1118,"Wed, 12 Jun 2019 13:14:51 -0400","The ""Halftime Report"" traders take viewer questions on Tesla.",Neutral,Should I sell Tesla now? in #AskHalftime,TSLA
1119,"Wed, 12 Jun 2019 12:05:29 -0400",Investors and analysts still aren't fully charged up on Tesla Inc. (NASDAQ: TSLA) despite CEO Elon Musk’s assertion that the company could have a “shot at a record quarter on every level” during the electric carmaker's Tuesday shareholder meeting.,Negative,"Tesla Analysts On Shareholder Meeting: Narrative 'Overly Negative,' 'Herculean Task' In Production Goals",TSLA
1120,"Wed, 12 Jun 2019 11:45:07 -0400",The Annual Shareholder Meeting was relatively uneventful.,Negative,Tesla: Record Short Interest,TSLA
1121,"Wed, 12 Jun 2019 11:38:00 -0400","Tesla's stock resembles Netflix in 2011 before its epic rally, says Eddie Yoon, founder of EddieWouldGrow and author of the book ""Superconsumers.""",Positive,Tesla's chart looks like Netflix did a decade ago—and it could see a similarly huge recovery,TSLA
1122,"Wed, 12 Jun 2019 11:13:17 -0400","Tesla stock wavered Wednesday following comments from Chief Executive Elon Musk, who touted the potential for a record quarter with Model 3 production at the company's annual meeting.
The post Tesla Stock Tries To Gain Ground As Musk Talks Positively About Future appeared first on Investor's Business Daily.",Positive,Tesla Stock Tries To Gain Ground As Musk Talks Positively About Future,TSLA
1123,"Wed, 12 Jun 2019 10:51:09 -0400",Jim Cramer is keeping a close eye on whether or not Tesla can reach profitability.,Positive,Why Jim Cramer's on Tesla (Stock of the Day),TSLA
1124,"Wed, 12 Jun 2019 09:32:16 -0400",Tesla CEO Elon Musk addressed concerns for the Model 3 claiming there was not a demand problem.,Neutral,Elon Musk is all business at Tesla shareholders meeting,TSLA
1125,"Wed, 12 Jun 2019 08:52:25 -0400","The ""Fast Money"" traders share their final trades of the day including TSLA, PANW, and more",Neutral,"Final Trades: Tesla, Palo Alto & SPY",TSLA
1126,"Wed, 12 Jun 2019 08:37:28 -0400","CEO Elon Musk spoke at Tesla's annual shareholder meeting in Mountain View, California on Tuesday.",Positive,Tesla analyst: Investors have been too bearish on the stock,TSLA
